{
  "schema": "choregos/ContextPack/v1",
  "query": "avoirs non déduits du total de facture",
  "paths": ["src/orders/**"], "kinds": ["decision", "incident", "ticket_summary"],
  "budget_tokens": 4000, "tokens_estimated": 1820, "truncated": false,
  "memories": [
    { "id": "mem_01J8", "kind": "decision", "subject": "decision:billing:totals-rounding",
      "content": "Les totaux sont arrondis au centime au moment de l'émission, jamais à l'affichage (ADR-0007).",
      "score": 0.91, "valid_from": "2026-03-04T00:00:00Z", "valid_to": null,
      "provenance": { "source": "scm", "ref": "docs/adr/0007-arrondis.md" } }
  ],
  "incidents": [
    { "id": "mem_01J9", "kind": "incident", "subject": "incident:billing-api:2026-06-11",
      "content": "Rollback après une régression sur les avoirs : le calcul avait été déplacé côté client.",
      "score": 0.78, "valid_from": "2026-06-11T14:00:00Z", "valid_to": null,
      "provenance": { "source": "cd", "ref": "release R-2026.06.11-1" } }
  ],
  "related_items": [
    { "key": "acme/billing-api#87", "title": "Avoirs partiels sur commande multi-lignes", "state": "deployed_prod",
      "url": "https://github.com/acme/billing-api/issues/87", "summary": "Ajout du champ credit_note_id." }
  ],
  "generated_at": "2026-09-18T09:14:02Z"
}
